店铺名称,页面id,类别,品牌名称,品牌id,品牌logo,评分,平均价格,最低价格,所属地区,地区Id,纬度,经度,详细地址,楼层,地铁站id,停车信息,优惠套餐情况,营业时间,联系电话,累计售出份数,餐厅简介,特色菜,是否小吃,有无外卖,上周订单数,历史订单数,wifi,支持预定
云海肴云南菜(金地广场店),1571382,云南菜,云海肴,30729,http://p1.meituan.net/poi/4bed67237de0935151a6d285519f0ab534818.png,4.5,88,88,大望路,14,39.90919,116.474402,朝阳区建国路91号金地广场C座3层,3,"21,3796,",,每满100减12（买单立享）;双人餐208元，4人餐418元;88代100元;,周一至周日 10:00-21:00,010-85712599/85712590,34881,云南云海肴（Mystic South-Yunnan Ethnic Cuisine）来自彩云之南，汇聚四海佳肴。推开古旧的老榆树门，掀开厚厚的门帘，迎面便是云南姑娘青涩的笑脸。店内的每个细节都是原汁原味的民族特色：来自云南的花梨大木桌，墙壁上的剪影是和着月影起舞的姑娘——恍惚间自己似乎也已置身鲜花盛开、翠竹遍地的彩云之南，醒来，也是花香满身。未曾食之，却已被这气氛搅得微醺。,,False,1,15,34881,True,False
吉野家(天通苑店),280367,日式快餐,吉野家,26363,http://p1.meituan.net/poi/701df473397a9a489e7ed59bae855d8741844.png,4.1,28,1.99,天通苑,4750,40.05866,116.41542,昌平区中东路东小口镇中滩村394号家乐福购物中心,2,"69,139,68,",免费停车,单人餐1.9元起，13元鱼香肉丝套餐，18元B8鸭腿饭，21元B12大碗鸡肉饭，24.9元B13辣猪双拼，29元B2鸡粒辣猪套餐，2-3人餐65元;,周一至周日 10:00-21:30,010-84812260,34846,吉野家是一家享有百年历史的著名日本牛肉饭专门店，始创於1899年，良心品质风行百年。吉野家一直以良心品质为本，所有食品均采用精选上等材料烹制而成，即叫即制，务求给予顾客最新鲜、**品质的食品。为了能令顾客无论何时何地都能品尝到少有的味美，吉野家一直始终如一地追求贯注「良心」的「真正品质」，为大家提供快速的服务，舒适的环境以及品质优良、价格合理的美食。日式快餐店。厅堂“干净明亮”，服务“快捷周到”，食物“原汁原味”，“营养健康”。牛肉饭“最经典”，肉“又嫩又香”，米饭“粒粒分明”。一些分店还连着DQ，吃完饭来份“暴风雪”，“爽就一个字”。,,False,1,543,34846,False,False
虾吃虾涮(建国路店),103097817,海鲜火锅,虾吃虾涮,2017476,http://p0.meituan.net/poi/a666ceb21dc91872999890e6221e2b6a61642.png,4.3,86,89,大望路,14,39.907538,116.472304,朝阳区建国路甲10号北京印刷二厂61栋,,"21,3796,127,",,双人餐138元，3-4人餐241元;89代100元;,周一至周日 09:00-23:30,010-85803289,34827,,,False,1,199,34827,True,False
上海小南国(悠唐广场店),1645231,其他上海菜,上海小南国,28503,http://p0.meituan.net/poi/16e2545348c895e0ab88d0ed47b38ee1149036.png,3.5,117,168,悠唐生活广场,14,39.921526,116.437967,朝阳区三丰北里2号悠唐购物中心二期4层402号,4,"35,1258,",免费停车,每满100减3（买单立享）;双人餐168元，4人餐298元;,周一至周日 11:00-21:30,010-85617871,34818,北京大牌美食护照集合了9大餐饮大牌,,False,1,111,34818,True,False
大鸭梨烤鸭店(天通苑西三区店),282569,烤鸭,大鸭梨,24976,http://p1.meituan.net/poi/a45acee85a01c13509676b448324d2f86549.png,4,65,88,天通苑,4750,40.07453,116.41009,昌平区天通苑西三区中福大厦3楼（天通尾货市场旁，近地铁天通苑站西）,,"67,68,",,满100减12（买单立享）;双人餐199元，3-4人餐298元，6-7人餐588元，9-10人餐888元;88代100元;,周一至周日 09:30-14:30 17:00-21:30,010-64113755/13520668117,34793,大鸭梨烤鸭店，老远就看见了就会让人想象到那张憨态可掬的笑脸，夸张的卡通造型像鸭又像梨，透着一份亲切。大鸭梨的陈设典雅大方，色调明快柔和，更显独特韵味。大鸭梨的饭菜好吃不贵。不论档次高低，每一道菜都被烹制得有形有色更有味，虽是家常，却不寻常低廉的价位更是难得，许多人干脆将这里当作自家饭厅，优质烤鸭：色泽红艳，肉质细嫩，味道醇厚，肥而不腻的特色，色泽略黄，柔软淡香，夹卷其他荤素食物用，为宴席常用面点，更是家常风味小吃,,False,1,156,34793,True,False
汗巴巴巴基斯坦餐厅(三里屯soho店),94679,中亚/中东菜,汗巴巴餐厅,699019,,4.8,65,75,三里屯/工体,14,39.932578,116.454032,朝阳区工体北路8号院三里屯SOHO2号商场5层511号,4,"124,",商家暂不提供停车位，建议您绿色出行,单人餐75元，双人餐166元，3-4人餐238元;,周一至周日 11:00-22:30,010-85270411/17800295203,34731,汗巴巴餐厅是一家主营巴基斯坦菜品的餐厅，风味独特，味道十分正宗，可谓是京城**代表性和象征性的餐厅。老板是地道的巴基斯坦人，开办此店为的正是推广当地餐饮美食，给驻京的巴基斯坦人提供一个最原汁原味的用餐环境。热情的巴基斯坦老板还讲着一口流利的中国话，与中国顾客沟通无障碍，让中国人可以充分了解巴基斯坦的饮食文化,,False,1,200,34731,True,False
松鹤楼(月坛店),320207,苏帮菜,松鹤楼,28910,http://p1.meituan.net/poi/781037311203e11f4ade3dcdb062585713554.png,3.6,141,92,月坛,16,39.914705,116.351881,西城区南礼士路乙9号院1号楼（近月坛公园南门）,,"11,27,12,",,8人餐1288元，10人餐1888元;92代100元;,周一至周日 11:00-14:00 17:00-21:00,010-68038959,34709,松鹤楼清乾隆22年（1757年）创始，迄今已有200多年的历史。名菜“松鼠桂鱼”吃过的人都赞不绝口，松鹤楼扬名天下。松鹤楼是苏州地区历史悠久、饮誉海内外的正宗苏帮菜馆。其专业技术实力雄厚，选料严谨、加工精细、富有特色，松鹤楼以经营苏帮菜为主，兼有淮扬帮的优雅鲜美和苏锡帮的浓油赤酱，更有苏帮菜的海纳百川，集各大菜系之精华。,,False,1,21,34709,True,False
正一味韩式料理(顺义华联店),41475547,韩国菜,正一味,677557,http://p0.meituan.net/poi/765c8bb570f89dcc303b44be0087e44f25946.png,3.8,34,27,顺义城区,708,40.128214,116.651873,顺义区仁和镇新顺南大街8号院1幢B1层28-29（华联商厦）,-1,"156,155,",免费停车,45代50元，88代100元;,周一至周日 10:00-21:00,010-81460473/010-63330775,34703,在韩国，情侣二人吃石锅拌饭的时候，男友一定要先替女友把饭搅拌好，若是女友无法将饭菜吃完，那么男友就要把剩下的饭菜吃个干干净净，以表达两人对爱情的忠贞不渝。虽然有些许的文化差异，但是美好的爱情总是在任何地方都能得到认同。,,False,1,59,34703,True,False
正一味(望京新世界店),296062,韩国菜,正一味,677557,http://p0.meituan.net/poi/765c8bb570f89dcc303b44be0087e44f25946.png,3.8,30,27,望京,14,39.986375,116.48107,朝阳区广顺南大街16号新世界百货地下一楼（近阜通东大街）,-1,"1491,1490,",,45代50元，88代100元;,周一至周日 10:00-21:00,010-84764478,34675,韩式快餐店。“每次都点”石锅拌饭——分量“大”，辣酱“香”，和菜、饭一拌“特别有滋味”；汤类和面食也“不错”，“值得一试”。人气“很旺”，服务员“递错单子、上菜慢是常有的事”。,,False,1,129,34675,True,False
万龙洲海鲜(亚运村店),263848,海鲜,万龙洲海鲜大酒楼,103543,http://p0.meituan.net/poi/686eacb3437816781858f90d0b8f4d7f168453.png,4.2,115,136,小营,14,39.98913,116.413054,朝阳区亚运村安慧里四区15号中国五矿大厦二层（近北苑路）,,"73,",,9.7折（买单立享）;2-3人餐136元，双人餐198元，4人餐398元，6人餐598元，8人餐989元，10人餐1689元;475代500元;,周一至周日 10:00-22:30,010-64989898/64969861,34672,万龙洲有限责任公司创立于1997年，主营海鲜粤菜。公司以经营鲜活平价海鲜起家，每日经营逾百种来自世界各地的生猛海鲜、质优价平、制作专业、味道鲜美、顾客盈门。开了诚信售卖海鲜的先河，使海鲜走进京城平常百姓家，现已发展到多家连锁店。酒店传承了古典欧洲浪漫主义，巴洛克式的建筑风格，恢弘气势的穹顶，繁复纷华的巨大水晶吊灯映衬着酒店的高雅格调，也是一直以来酒店所秉承的根本理念。,,False,1,127,34672,True,False
紫光园(红庙总店),263307,北京菜,紫光園,31015,http://p0.meituan.net/poi/07bac06d7eb1a62dfce462bb1ef657e913088.png,4.3,57,9.99,朝阳区,14,39.915748,116.481197,朝阳区红庙北里85号楼（华商大厦西侧）,,"3796,1261,1487,21,",,满100减8（买单立享）;双人餐9.9元，单人餐16元，2-3人餐85元;92代100元;,周一至周日 05:00-22:00,010-65025745,34648,“遍地开花”的家常餐馆。菜品“大众口味”，“量多价廉”，“没什么出彩的”，也“不会让人失望”（有人说随着“时间的流逝”、“物价的上涨”，性价比略有“下降”）。环境、服务“还不错”，生意“太好了”，“人多、嘈杂”。“平时家里懒得做饭”或者朋友聚会想“找个实惠又有包间的地方”会考虑去那里。,,False,1,120,34648,True,False
小渔港(鲁谷店),1659544,烤鱼,小渔港 ,472887,http://p0.meituan.net/poi/0870e7d80b462c95628f3249cccd763875731.png,4.3,56,148,鲁谷,172,39.903574,116.223568,石景山区鲁谷路永乐西小区9号楼底商（万达广场南30米）,,,停车位收费标准：请咨询店里商家,2-3人餐148元，4人餐158元起，4-6人餐158元，4人餐158元起;,周一至周日 09:30-24:00,010-57028188,34616,小渔港经营的烤鱼由专门的厨师负责，**化的保证了烤鱼的美味鲜香，口味纯正。小渔港提供的所有的菜品，保证**没有任何食品添加剂，全部都是绿色、健康的美味佳肴。所有产品全部都是精挑细选，时时更新，每一天都给人新的惊喜。餐厅服务热情，这里是朋友聚会、商务宴请的好去处,,False,1,77,34616,True,False
渝乡人家(复兴门百盛店),262951,川菜,渝乡人家,748209,http://p0.meituan.net/poi/c674f212c1d8e25509fb46afca58bde75285.jpg,3.6,68,98,复兴门,16,39.908082,116.358034,西城区复兴门内大街101号百盛购物中心南楼7层,7,"12,27,11,",有停车位,98代100元;,周一至周日 11:00-21:00,010-66023706/66072505,34598,“吃了好多年”的店，已然成为“咱家的第二食堂”。水煮鱼“油亮亮”、“香喷喷”；毛血旺配料“丰富”，光看就让人“满足”；川北凉粉“晶莹剔透”。总之，“好吃的太多了”（可惜分量“少了点”）。价格嘛，“不算实惠”，但仍在可接受范围内。,,False,1,49,34598,True,False
羲和三里(三里屯太古里店),51952372,烤鸭,羲和三里,2885735,,4.9,104,9.9,三里屯/工体,14,39.934009,116.453876,朝阳区三里屯路19号（优衣库3层西侧）,3,"124,",,每满100减5（买单立享）;单人餐9.9元起，双人餐159元起，4人餐628元，6人餐858元;100代115元，200代238元，300代366元;,周一至周日 11:00-14:00 17:00-21:00,010-64176082,34588,,,False,1,785,34588,True,False
竹园村大酒店(五棵松店),264194,火锅,竹园村火锅,30988,http://p1.meituan.net/poi/a74524477ea031abe0971fddc75a4f7518067.png,4.1,82,138,五棵松,17,39.903301,116.260246,海淀区北太平路16号（采石路北口）,,"5,",停车位收费标准：免费提供车位,每满100减5（买单立享）;双人餐138元，4人餐238元;,周一至周日 10:30-21:00,010-88625688,34539,竹园村火锅借竹之品性来勉励企业行君子之道，故取名“竹园村”。竹园村以醇正的火锅口味，实惠的消费价格，舒适的就餐环境，优质的规范服务，带给顾客家一般的温馨。公司依托博大精深的三秦饮食文化，源于巴蜀，融入秦韵，品味独创，孕育了“竹园村”牌系列火锅，集酸、香、麻、辣为一体，成为独具特色的陕西火锅品牌，填补了历史上秦菜无自己火锅的空白。其汤醇、味美、菜鲜、价宜，特别是热烈、豪放、清香、刺激的独特风格和张扬的个性使顾客百吃不厌、回味无穷。竹园村自制的豆腐、豆芽、豆花、豆腐皮、豆腐干等系列豆制品，自酿酸菜等自制的天然绿色食品深受消广大费者的喜爱。,,False,0,9,34539,True,False
小肥羊(西三旗店),6234783,牛羊肉火锅,小肥羊,1826094,http://p0.meituan.net/poi/6c2857de867da3c02af425ec28de8d6454072.png,3.9,89,39,西三旗,17,40.057145,116.329545,海淀区建材城西路87号2号楼2楼201-8室商铺,1,,,单人餐39元，2-3人餐59元，双人餐60元;70代100元，78代100元;,周一至周日 10:00-24:00,010-82969918/82969919,34526,小肥羊以经营特色火锅为主业，兼营小肥羊调味品及专用肉制品的研发、加工及销售业。拥有调味品基地，肉业基地，物流配送中心和外销机构，搭建起从牧场田间到餐桌的食品安全保障体系。以天然、健康的品质，快乐、共享的理念，弘扬中华餐饮文化。,,False,1,116,34526,True,False
北京粤财JW万豪酒店JW Kitchen,42652573,综合自助,,0,,3.9,292,109,宣武门,16,39.8954,116.37561,西城区宣武门外大街18号北京粤财JW万豪酒店4层（宣武门SOGO旁边）,4,"59,29,60,1465,30,",免费提供10个停车位,其他109元，单人午餐198元，单人午餐228元，单人晚餐268元，单人晚餐268元，单人晚餐308元，单人晚餐308元;,周一至周日 06:00-21:30,010-63916391,34515,,,False,0,71,34515,True,False
芦月轩羊蝎子(科丰店),339440,羊蝎子,芦月轩,957116,,5,64,89.9,看丹桥/新华街,20,39.833613,116.292581,丰台区科学城帝京路5号楼C座（科丰桥东）,,"105,104,",,3-4人餐246元;89.9代100元;,周一至周日 11:00-23:00,010-63799618,34513,冲着他家羊蝎子来的。“扑鼻”的香气让人食指大动，肉炖得“很烂”，骨髓“多”，味道“美极了”；分量还“相当足”，“两三个人吃小锅就够了”。要是再点些宽粉、炸腐竹什么的涮在里面，得撑个“肚歪”。价格也“挺实惠”。只是服务“差了些”，“没眼力见儿”。,,False,0,91,34513,True,False
小辉哥火锅(荟聚购物中心西红门店),40200340,小火锅,小辉哥火锅,476522,http://p0.meituan.net/poi/a885c55300f5aad8a9a76a5c445782d328354.png,3.6,101,0,西红门,4752,39.78704,116.326063,大兴区欣宁街15号荟聚购物中心3层,3,"186,5270,",,每满100减8，每满100减5（买单立享）;,周一至周日 11:00-22:00,010-50931899,34450,小辉哥火锅自2012年首家五角场店开幕后，以其“年轻，美味，潮流”为沪上食客带来了全新的“小火锅”潮流体验。小辉哥火锅出身名门——辉哥集团，是其旗下新推出的年轻、时尚品牌。2013年小辉哥火锅现已进驻沪上各热门大人气商圈——打浦桥上海日月光中心；静安梅龙镇广场；浦东正大广场；以及徐汇港汇恒隆广场等；掀起沪上小火锅新热潮,,False,1,26,34450,True,False
吉野家(SOGO新馆店),263982,日式快餐,吉野家,26363,http://p1.meituan.net/poi/701df473397a9a489e7ed59bae855d8741844.png,4.1,28,1.99,宣武门,16,39.896186,116.37534,西城区宣武门外大街12号SOGO新馆6层,6,"59,29,60,1465,30,",,单人餐1.9元起，13元鱼香肉丝套餐，18元B8鸭腿饭，21元B12大碗鸡肉饭，24.9元B13辣猪双拼，29元B2鸡粒辣猪套餐，2-3人餐65元;,周一至周日 10:00-22:00  2019-02-04 10:00-17:00 2019-02-05 11:00-21:30,010-63102760,34408,吉野家是一家享有百年历史的著名日本牛肉饭专门店，始创於1899年，良心品质风行百年。吉野家一直以良心品质为本，所有食品均采用精选上等材料烹制而成，即叫即制，务求给予顾客最新鲜、**品质的食品。为了能令顾客无论何时何地都能品尝到少有的味美，吉野家一直始终如一地追求贯注「良心」的「真正品质」，为大家提供快速的服务，舒适的环境以及品质优良、价格合理的美食。日式快餐店。厅堂“干净明亮”，服务“快捷周到”，食物“原汁原味”，“营养健康”。牛肉饭“最经典”，肉“又嫩又香”，米饭“粒粒分明”。一些分店还连着DQ，吃完饭来份“暴风雪”，“爽就一个字”。,,False,1,266,34408,True,False
云海肴云南菜(凯德mall大峡谷店),1496207,云南菜,云海肴,30729,http://p1.meituan.net/poi/4bed67237de0935151a6d285519f0ab534818.png,4.3,84,95,马家堡/角门,20,39.854646,116.366435,丰台区南三环西路16号凯德mall.大峡谷4层,4,"63,",,每满100减6（买单立享）;双人餐148元起，3-4人餐330元，4人餐368元，4-5人餐399元;95代100元;,周一至周日 11:00-21:30,010-87576066,34342,云南云海肴（Mystic South-Yunnan Ethnic Cuisine）来自彩云之南，汇聚四海佳肴。推开古旧的老榆树门，掀开厚厚的门帘，迎面便是云南姑娘青涩的笑脸。店内的每个细节都是原汁原味的民族特色：来自云南的花梨大木桌，墙壁上的剪影是和着月影起舞的姑娘——恍惚间自己似乎也已置身鲜花盛开、翠竹遍地的彩云之南，醒来，也是花香满身。未曾食之，却已被这气氛搅得微醺。,,False,1,24,34342,True,False
西树泡芙(金源新燕莎MALL店),2560072,西式甜品,西树泡芙,1005431,http://p1.meituan.net/poi/15621cab9b636c13addf58b3240221af52413.png,4.1,24,34,远大路,17,39.958589,116.290979,海淀区远大路1号金源新燕莎MALL南街东区4层4074,4,"1269,1268,",免费停车,38元特惠泡芙3只装，45元脏脏泡芙分享餐，68元经典多人分享餐;34代40元;,周一至周日 10:00-21:00  2019-02-04 10:00-17:00,13718202997,34335,西树，源于法语Chez Choux，意为“泡芙之家”。专注于追求泡芙的**美味，将经典法式甜品文化与正统日式手作工艺相结合，**配方密制曲奇泡芙，自主开发“曲奇派式泡芙”，精工细作，现烤现卖。将酥松香甜发挥到优越，令口感更富层次。每一个新鲜现场制作的泡芙都是外皮酥松香甜，内馅香滑可口。西树泡芙抱着对泡芙美味的孜孜追求，致力于传播新鲜健康的新甜品观，于大众共同分享甜美。因而，每个西树泡芙都是“make for you”---在客人面前现场制作，向您奉献西树泡芙新鲜的天然原味。,,False,1,35,34335,True,False
青柠泰餐厅(北京apm店),5209644,泰国菜,青柠泰餐厅,1137283,,4.5,97,95,王府井/东单,15,39.915194,116.411891,东城区王府井大街138号北京apmB区5层501-503,5,"81,16,4875,",,双人餐268元，4人餐528元;95代100元;,周一至周日 11:00-16:00 17:00-21:30,010-65262862,34297,正宗泰式美食，感受心灵契合，青柠泰餐厅是一家很别致的泰国餐厅供应地道泰国菜，成立于2010，在北京市朝阳区新城国际开设**家餐厅。于2012年6月，第2家餐厅开设于世界城商业街。青柠泰餐厅是由 Mr. Thunyadul Kongseree 泰国室内设计师设计，配以美酒和地道的泰国美食于一体，让顾客在餐饮过程中感受到异国文化和美食。 青柠泰餐厅的烹调由传统的泰国菜至餐厅的招牌菜，所有菜式均是让你难忘。这是泰藉厨师和厨师团队的心灵制作，配以恰当的泰国香料和原材料，让食客份外满意并有别于其他菜馆的用餐体验。,,False,1,85,34297,True,False
太熟悉烤鸭·鱼头泡饼(右安门店),266000,家常菜,太熟悉家常菜,28977,http://p1.meituan.net/poi/137510e047e02974f33a169c816a809977600.png,4.1,72,58,北京南站/开阳里,20,39.866957,116.364631,丰台区右安门外大街开阳里1区4号楼右外大厦1楼（右安门桥东南角）,,,免费停车,2-3人餐58元，双人餐198元起，4人餐339元起;96代100元;,周一至周日 10:00-23:00,010-63572696/63577398,34291,“跟开在自家后院似的”，“去过太多次了”。家常菜虽“没啥特色”，但做得比较“合口”。水煮鱼“麻辣到位”，烤鸭“味道不错”，宫保鸡丁“得点两份”才过瘾。价格也“实惠”，“适合咱老百姓”。就是“人多吵闹”，服务有点“跟不上”。,,False,1,216,34291,True,False
九头鸟酒家(航天桥店),263886,湖北菜,九头鸟酒家,162692,http://p1.meituan.net/poi/11b838d07c0a04a0912f776e7dcf14a6208274.png,3.9,63,95,航天桥,17,39.923465,116.307754,海淀区西三环中路航天桥西南角航天商务院内1楼,,"1272,",免费提供15个停车位,8人餐688元;95代100元;,周一至周日 10:30-22:00,010-68489278,34166,九头鸟酒家创立于湖北武汉，成长于北京。现旗下拥有二十多家品牌连锁店，千余员工，已成为首都餐饮界知名的大型连锁企业，以优质的服务和别具特色的菜肴深受京城百姓的好评。 九头鸟酒家不仅在选料、做工上精益求精，而且将湖北楚乡文化融入其中。其新派湖北菜在传统做法的基础上，又融合了中西方的不同风格，别具特色,,False,1,151,34166,True,False
渔者日本料理(通州土桥店),52571088,日本菜,,0,,3.8,79,38,土桥,4751,39.870685,116.695743,通州区砖厂南里40号楼华远好天地内（迪卡侬）,1,"183,",免费提供5个停车位,单人餐38元起，单人晚餐188元，单人午/晚餐258元，双人餐298元;95代100元;,周一至周日 11:00-14:00 17:00-22:00  2019-02-04至2019-02-05 休息,010-80857991/13701288971,34160,,,False,0,185,34160,True,False
海盗猫烤鱼餐厅(朝阳大悦城店),4225759,烤鱼,海盗猫,2624021,,3.6,88,208,朝阳大悦城,14,39.924396,116.518227,朝阳区朝阳北路101号朝阳大悦城7层（乘4号直梯出门右转20米，或6号直梯出门正对面即到）,7,"1263,",,双人餐208元，4人餐298元起;,周一至周日 10:00-21:30,010-85529811,34135,,,False,1,121,34135,True,False
源食汇烤鸭店(万柳店),294929,烤鸭,,0,,4.7,81,95,万柳,17,39.965843,116.303745,海淀区万泉河路小南庄400号（龙都宾馆院内，近万柳东路）,,,停车位收费标准：免费提供,2-3人餐98元，4人餐128元起，8人餐598元;95代100元;,周一至周日 10:30-14:00 17:00-21:00,010-62529588/62527588,34122,北京鸭的道地产地潮白河畔，这里的北京鸭远近闻名，其肉质肥嫩，味道鲜美，体大皮薄，雍容丰满，是“烤鸭”最好的原材料，用北京鸭烤出的鸭子，其鲜美程度远远超过其他品种的鸭子，金百万从其中挑选上等鸭胚，通体白净、丰韵肥美，均在6斤半以上。上等鸭胚，搭配高科技的数码烤炉，使得无论鸭皮厚度、脆度、鸭肉的鲜嫩程度，都堪比20年地道老师傅的手艺。,,False,1,0,34122,True,False
眉州东坡酒楼(大兴店),290774,川菜,眉州东坡酒楼,840209,http://p1.meituan.net/poi/22f83d3ddb274d5140e7158223eb093312092.png,4.2,83,95,黄村,4752,39.732822,116.343895,大兴区龙河街133号（公安局旁）,,"5267,191,",,95代100元;,周一至周日 06:30-22:00,010-69232277/69232200,34102,1996年6月6日，由全国人大常务委员会副委员长王光英题匾，并经北京市朝阳区工商局注册的**家眉州东坡酒楼在京开业。为使企业得到迅速发展，企业于2003年6月24日成立了以饭店管理、餐饮服务、食品加工及销售为主要经营范围的北京眉州酒店管理有限公司，并在京设立公司总部，包括物流中心、中央厨房，注册资金6000万元。公司现已成为旗下拥有“眉州东坡酒楼”、“王家渡火锅”、“眉州小吃”、“眉州私家厨房”、“四川王家渡食品有限公司”五大业态、五十多家分店、6000多名员工的大型餐饮连锁集团。2011年5月31日，成立北京眉州东坡万景投资有限公司，以传承“东坡文化”为核心，以“东坡美食文化”为载体，发展集团美食、娱乐、休闲、购物、旅游、商务等多种业务为一体的服务综合体。将在湖北黄冈市开发十万平方米左右的商业综合项目。,,False,1,88,34102,True,False
星怡会(望京凯德MALL店),41103273,新加坡菜,星怡会,615016,http://p1.meituan.net/poi/da4590d01732fff21cb11f31e16fb71831224.png,5,88,95,望京,14,39.991943,116.469169,朝阳区广顺北大街33号凯德MAL6楼（福马大厦，里外里公）,6,"1490,147,1485,",,每满100减5（买单立享）;双人餐128元起，3-4人餐189元;95代100元;,周一至周日 10:30-21:30,010-64738979/18701079763,34091,,,False,1,103,34091,True,False
汉拿山(亚运村店),4556348,韩式烤肉,汉拿山,25856,http://p0.meituan.net/poi/2c0577def9e51d5dbb131e5d8fcf419a54667.png,4.2,97,95,亚运村,14,39.989144,116.410627,朝阳区安慧里4区16号（亚运村北四环安慧桥东北角）,,"73,",有停车位,双人餐228元，4人餐428元;95代100元;,周一至周日 10:30-21:00  2019-02-04 10:00-18:00 2019-02-05 10:00-20:00,010-84885858,34060,北京大牌美食护照集合了9大餐饮大牌,,False,1,218,34060,True,False
