店铺名称,页面id,类别,品牌名称,品牌id,品牌logo,评分,平均价格,最低价格,所属地区,地区Id,纬度,经度,详细地址,楼层,地铁站id,停车信息,优惠套餐情况,营业时间,联系电话,累计售出份数,餐厅简介,特色菜,是否小吃,有无外卖,上周订单数,历史订单数,wifi,支持预定
眉州东坡(国奥村店),375596,川菜,眉州东坡酒楼,840209,http://p1.meituan.net/poi/22f83d3ddb274d5140e7158223eb093312092.png,4.5,81,95,鸟巢/水立方,14,40.008494,116.381384,朝阳区林萃东路2号院甲3号楼国奥中心A座,,null,,95代100元;,周一至周日 10:00-00:00,010-57393285,69161,眉山，古称眉州，位于四川盆地西南。已有一千四百多年建制历史，物产丰盈、代出人才。被列为“唐宋八大家”的苏洵、苏轼、苏辙父子三人皆出于眉州。其中大文豪苏东坡亦为美食大家，他一生行遍全国十六个城市，尝遍各地美食，开创了一套独特的东坡菜系和儒雅食风，成为中华饮食文化中的瑰丽篇章。来自苏东坡故乡的创始人王刚先生，十六岁入京学习烹饪技艺，得叶剑英元帅家厨，被誉为“总统厨师”的甘国清大师真传。经多年磨练和潜心钻研，练就了过硬的烹饪技艺，在继承东坡饮食文化方面做了大量的整理、研制和创新工作，形成了一套以东坡文化为底蕴，以川菜为基础，集八大菜系之长的眉州东坡菜式。1996年4月，**家眉州东坡酒楼在京开业。在王刚先生的带领下，企业全体员工致力于弘扬东坡文化，塑造眉州东坡品牌，使企业得到迅速发展，已实现以北京、四川、河北、湖北、陕西、美国为中心，覆盖全国，放眼世界，旗下拥有“眉州东坡酒楼”、“王家渡火锅”、“眉州小吃”、“眉州私家厨房”、“小渡火锅”、“四川王家渡食品有限公司”六大业态、近百家分店的大型连锁集团。公司以源全5S为管理基础，以ISO9001管理体系为主要产品执行标准，以HACCP管理体系为食品安全管理标准。先后荣获“四川餐饮名店”、“中华餐饮名店”、“亚洲餐饮名店”等，连续两届获得“北京市著名商标”，09年以来连续三年荣获 “北京十大商业品牌”，并于2012年晋升金奖，2013年2月蝉联金奖。2012年6月，在北京举行的首届奥林匹克公园国际美食大赛中获得以中华厨祖命名的**奖项——伊尹金像奖。2012年12月，被国家商标总局认定为“中国驰名商标”。2008年6月，经过层层筛选，公司成为第29届奥林匹克运动会组织委员会奥运村（残奥村）运行团队餐饮服务商，并获得了“中国味道，奥运标准”的殊荣。“眉州天下佳肴，东坡千古风韵”。眉州东坡正以东坡精神和奥运精神为指引，不断超越自我，为实现“为全世界人民做饭”的宏伟愿景而不懈努力。,,False,1,146,69161,True,False
金百万烤鸭店(马家堡店),1127138,烤鸭,金百万,26508,http://p0.meituan.net/poi/594f1eb7400911cadbee589ed64c9cb8132629.png,4,80,90,马家堡/角门,20,39.84685,116.37074,丰台区马家堡西路15号时代风帆大厦北侧商用楼4楼（地铁四号线角门车站）,,"1284,64,63,",停车位收费标准：免费提供,2-3人餐108元，5-6人餐138元，4人餐398元;90代100元;,周一至周日 11:00-14:00 17:00-21:00,010-67526002/67527257,69132,北京鸭的道地产地潮白河畔，这里的北京鸭远近闻名，其肉质肥嫩，味道鲜美，体大皮薄，雍容丰满，是“烤鸭”最好的原材料，用北京鸭烤出的鸭子，其鲜美程度远远超过其他品种的鸭子，金百万从其中挑选上等鸭胚，通体白净、丰韵肥美，均在6斤半以上。上等鸭胚，搭配高科技的数码烤炉，使得无论鸭皮厚度、脆度、鸭肉的鲜嫩程度，都堪比20年地道老师傅的手艺。,,False,1,92,69132,True,False
松香韩式自助烤肉店(亮马桥店),308482,烤肉自助,,0,,3,56,18.8,三元桥,14,39.951473,116.469799,朝阳区亮马桥路光明饭店B1楼（近朝阳公园）,,"122,1492,",免费停车,单人餐18.8元起，单人午/晚餐78元，单人午餐78元，单人午/晚餐78元;,周一至周日 11:30-21:00,010-84418399,68599,松香自助烤肉，地道韩国风味，韩国大厨操作，能同时容纳180多人，身在中国同时体验韩国风味！07年柳铉顺董事长在中国创办韩式松香自助烤肉，始终坚持保持韩国特色风味，食材以及酱料成为质量的保证。由韩国主厨亲自为您烹制的地道韩国料理,,False,0,423,68599,True,False
汉拿山(富力城店),297203,韩式烤肉,汉拿山,25856,http://p0.meituan.net/poi/2c0577def9e51d5dbb131e5d8fcf419a54667.png,4,94,95,双井,14,39.894721,116.461112,朝阳区东三环中路65号富力广场北区8层,8,"1466,128,1451,",免费停车,双人餐228元，4人餐428元;95代100元;,周一至周日 10:00-22:00  2019-02-04至2019-02-05 10:00-18:00,010-59037355,68534,北京大牌美食护照集合了9大餐饮大牌,,False,1,167,68534,True,False
麻小·麻辣诱惑(崇文门店),279090,小龙虾,麻辣诱惑,27492,http://p0.meituan.net/poi/9ed44566e70021054f394a8c0be99d6418396.png,4.6,84,75,崇文门,15,39.89653,116.419249,东城区崇文门外大街40号搜秀城七层,7,"84,1454,83,32,1463,",,9.6折（买单立享）;126元菜品，249元菜品，258元大闸蟹尝鲜套餐;75代100元，96代100元;,周一至周日 11:00-22:00,010-51671099,68468,麻辣诱惑集团创始于2002年，总部位于北京，截至到2013年9月在北京、上海、天津、石家庄、南京、武汉、西宁拥有30家直营门店。“麻辣诱惑”的品牌名称充分体现了公司的经营特色和市场定位，根据对麻辣口味细分市场的深入分析和调研，麻辣诱惑发现“麻辣”味型是一种趋势而不只是一种流行，符合现代人尤其是广大年轻人的饮食需求，具有广泛的市场基础和巨大的发展前景，“诱惑”更进一步体现出麻辣口味菜品带给人以美味的享受、强烈的刺激及身心的愉悦，这些都深深地吸引着广大麻辣口味嗜好者，使人思之垂涎，欲罢不能。,,False,1,88,68468,True,False
正一味(君太百货店),312595,韩国菜,正一味,677557,http://p0.meituan.net/poi/765c8bb570f89dcc303b44be0087e44f25946.png,3.8,33,27,西单,16,39.909909,116.372822,西城区西单北大街133号君太百货B1楼,-1,"58,13,57,",免费停车,45代50元，88代100元;,周一至周日 10:00-21:00,010-66518489,68207,韩式快餐店。“每次都点”石锅拌饭——分量“大”，辣酱“香”，和菜、饭一拌“特别有滋味”；汤类和面食也“不错”，“值得一试”。人气“很旺”，服务员“递错单子、上菜慢是常有的事”。,,False,1,327,68207,True,False
富丽园自助餐,162204986,综合自助,,0,,3.2,74,75,昌平镇,4750,40.220365,116.232468,昌平区政府街20号鑫隆商厦4楼（昌平地铁西行100米）,,,,单人午餐75元，单人午/晚餐79元，单人午餐79元，单人午/晚餐89元;,"周一至周五 11:00-14:00 17:00-21:00  周六,周日 11:00-14:30 17:00-21:30",010-89780167,68094,,,False,0,901,68094,False,False
豫香缘黄焖鸡米饭,4322245,黄焖鸡,,0,,5,17,16.9,学院路,17,40.00157,116.339351,海淀区清华东路甲1号凯时广场B102-3（近矿大北门）,-1,"1482,133,",,16.9元黄焖鸡套餐，23.9元黄焖排骨套餐;42代50元;,周一至周日 09:00-21:00,010-57450456/15729045555,68049,,,False,0,41,68049,False,False
山之川海鲜放题(亚运村店),69788,日料自助,山之川创作料理,484760,,4.2,162,95,亚运村,14,40.002266,116.404007,朝阳区大屯路慧忠里201楼华夏良子旁边（第五大道斜对面）,,"1480,96,",,单人餐259元起，单人午/晚餐359元;95代100元;,周一至周日 11:00-14:00 17:00-22:00  2019-02-03至2019-02-09 休息,010-64895656,67920,太和屋日本料理地道不光体现在做法技艺、食材配料上，店内的大小细节都将和风体现的满满。木质的门窗，类似榻榻米的餐桌，干净暖黄的灯光，日式风格的摆设、餐具等等。和风之外，透着些许温馨情调，和朋友面对而坐，小侃几句，再合适不过。,,False,0,181,67920,True,False
辣尚瘾(航天桥店),1079666,干锅/香锅,辣尚瘾,27080,http://p1.meituan.net/poi/32c0f75cc9e6f3fbf000ac75878a9da734210.png,4.7,62,95,航天桥,17,39.924656,116.316399,海淀区阜成路23号（近工商大学西区东门）,,"1474,1250,",免费停车,每满100减5（买单立享）;95代100元;,周一至周日 10:30-22:00,010-68988511,67817,辣尚瘾，以传承民间美食文化，引领时尚新生活为已任，致力于打造民间特色餐饮品牌。无麻不成味，无辣则不欢。餐饮江湖经历了无数硝烟更迭，如今的辣潮流当属红极京城的麻辣香锅和烤鱼。而辣尚瘾两者兼有，被誉为“黄金搭配、黄金组合”。,,False,1,51,67817,True,False
辣莊(东直门店),70147423,重庆火锅,,0,,5,94,89,北新桥/簋街,15,39.941168,116.421636,东城区东直门内大街201号,,"78,79,77,38,",,双人餐99元，3-4人餐238元;89代100元;,周一至周日 10:30-03:00,010-56260666,67721,,,False,1,174,67721,True,False
眉州东坡(亚运村店),263888,川菜,眉州东坡酒楼,840209,http://p1.meituan.net/poi/22f83d3ddb274d5140e7158223eb093312092.png,4.3,80,95,亚运村,14,40.005479,116.405325,朝阳区慧忠北里111号楼金利大厦（近奥林匹克森林公园）,,"1480,",,95代100元;,周一至周日 06:30-10:00 11:00-03:00,010-59683315/400-852-7527,67394,1996年6月6日，由全国人大常务委员会副委员长王光英题匾，并经北京市朝阳区工商局注册的**家眉州东坡酒楼在京开业。为使企业得到迅速发展，企业于2003年6月24日成立了以饭店管理、餐饮服务、食品加工及销售为主要经营范围的北京眉州酒店管理有限公司，并在京设立公司总部，包括物流中心、中央厨房，注册资金6000万元。公司现已成为旗下拥有“眉州东坡酒楼”、“王家渡火锅”、“眉州小吃”、“眉州私家厨房”、“四川王家渡食品有限公司”五大业态、五十多家分店、6000多名员工的大型餐饮连锁集团。2011年5月31日，成立北京眉州东坡万景投资有限公司，以传承“东坡文化”为核心，以“东坡美食文化”为载体，发展集团美食、娱乐、休闲、购物、旅游、商务等多种业务为一体的服务综合体。将在湖北黄冈市开发十万平方米左右的商业综合项目。,,False,1,141,67394,True,False
汉丽轩烤肉自助餐厅(物资学院店),78185273,韩式烤肉,汉丽轩,23787,http://p1.meituan.net/poi/23c31c21b38ee08a975cfb821d4f5600109505.png,3.4,53,66,八里桥,4751,39.923269,116.640281,通州区物资学院路华联购物广场（恒豪酒店对面）,,"1447,",免费提供20个停车位,单人午餐66元，单人晚餐76元;,周一至周日 11:00-14:30 17:00-21:30,010-65496771,67299,,,False,0,360,67299,True,False
烧虾师(工体店),40450374,小龙虾,,0,,4,127,93,工体,14,39.933214,116.446299,朝阳区工人体育场北门,,,,93代100元;,周一至周日 11:00-14:00 17:00-04:30  2019-09-07至2019-10-02 休息,010-51657733/65528818,66951,,,False,1,385,66951,True,False
吉野家(东直门银座mall店),277279,日式快餐,吉野家,26363,http://p1.meituan.net/poi/701df473397a9a489e7ed59bae855d8741844.png,4.2,27,1.99,三里屯/工体,14,39.940262,116.435472,朝阳区东直门外大街48号东直门银座mallB1层,-1,"214,37,145,36,",,单人餐1.9元起，13元鱼香肉丝套餐，18元B8鸭腿饭，2-3人餐65元;,"周六,周日 10:00-21:30  周一至周五 08:00-22:30",010-84477891,66876,日式快餐店。厅堂“干净明亮”，服务“快捷周到”，食物“原汁原味”，“营养健康”。牛肉饭“最经典”，肉“又嫩又香”，米饭“粒粒分明”。一些分店还连着DQ，吃完饭来份“暴风雪”，“爽就一个字”。,,False,1,614,66876,True,False
零度空间(五道口店),1500694,台湾菜,零度空间,27340,http://p0.meituan.net/poi/92a0e577b78ccb3a938799e845888ccc87787.png,4.2,64,48,五道口,17,39.992057,116.339239,海淀区成府路28号五道口购物中心5层,5,"133,1482,",商家不提供免费停车位,双人餐48元起，双人餐48元起;95代100元;,周一至周日 10:00-22:00,010-62660599,66871,零度空间是一家经营台湾美食、创意菜、咖啡、时尚饮品、香港甜品为主的时尚休闲餐厅。拥有一支餐饮百强连锁企业多年工作经验，市场实战经验 的管理团队。我们整合行业资源把握市场流行趋势，不断创新，打造经典美味的餐品和饮品，向广 大消费者提供满意的餐饮和消费体验，在国内树立起一个质量上 乘、文化内涵深厚的著名品牌。零度空间兄弟品牌---食度餐,,False,1,308,66871,True,False
眉州东坡酒楼(恋日店),266010,川菜,眉州东坡酒楼,840209,http://p1.meituan.net/poi/22f83d3ddb274d5140e7158223eb093312092.png,5,79,95,马家堡/角门,20,39.846279,116.357868,丰台区镇国寺北街草桥欣园1区五号楼,1,"1285,5249,",,95代100元;,周一至周日 06:30-24:00,010-87583351/010-87583362,66804,“全家人都喜欢”的川菜馆。菜式有些“不落俗套”的改良，口味也“不太会出错”。东坡肘子确实“不一般”，“软烂”的皮、“咸中带甜”的肉、“滑而不腻”的膘，“想想就流口水”。香肠也“吐血推荐”，有“原味和香辣”两种，“超级下饭”。用餐时段，大堂“非常热闹”，服务员难免“忙不过来”。,,False,1,138,66804,True,False
丁丁洋回转自助火锅(百子湾路店),6134155,火锅自助,丁丁洋回转自助火锅,95307,http://p1.meituan.net/poi/186877d3baced77510b8c1ffdf2fc92239508.png,3.9,40,39.9,百子湾,14,39.901264,116.4972,朝阳区百子湾路15号（永辉超市1楼服务台对面）,1,"171,22,",,单人午/晚餐39.9元;,周一至周日 11:00-22:00,010-57859320,66766,丁丁洋回转自助火锅主要经营回转火锅自助餐饮。丁丁洋颠覆中国传统经营火锅模式，通过回转机械传送美食。在这种独特、极具创意的全新模式下，让顾客在自助的形式中享受休闲火锅带来的酣畅淋漓的感觉。,,False,0,348,66766,True,False
蛙蛙叫干锅年代(簋街北京总店),1387948,干锅/香锅,蛙蛙叫干锅年代,29237,http://p1.meituan.net/poi/526261c267595809e289a8e1d9a91d2562361.png,4.3,81,90,北新桥/簋街,15,39.940566,116.417344,东城区东直门内大街288-6号,,"78,79,77,38,",免费提供20个停车位,2-3人餐156元，2-3人餐183元，4-5人餐245元，4人餐338元，6-8人餐476元;90代100元;,周一至周日 11:00-04:00,010-64093077/64093177,66644,一锅两吃的“蛙蛙叫”干锅年代是南京春天食港餐饮管理有限公司的旗舰品牌，坚持“以诚经商，以诚兴店”的经营理念，现今在上海、深圳、沈阳、浙江及江苏省各地已发展有50多家店，蛙蛙叫拥有大批专业的厨师力量和物资配送中心、人员培训中心,,False,1,160,66644,True,False
芦月轩羊蝎子(北蜂窝店),1516142,羊蝎子,芦月轩,957116,,5,68,89.9,北京西站/军博,17,39.906041,116.329247,海淀区北蜂窝路甲2号（北京市铁路局西门南侧会城门邮局对面）,,"9,1473,10,",,3-4人餐246元;89.9代100元;,周一至周日 11:00-23:00,010-63452234,66613,                            ,,False,0,396,66613,True,False
新辣道鱼火锅(回龙观店),3290882,鱼火锅,新辣道,1833433,http://p0.meituan.net/poi/26ef5d50481923db677d37085ce964e322599.png,4.8,94,50,回龙观,4750,40.071893,116.337572,昌平区育知东路30号院BHG Mall北京华联同成街购物中心4楼（城铁13号线回龙观站对面）,4,"137,",免费停车,每满100减9（买单立享）;50代100元，73代100元，91代100元;,周一至周日 09:30-21:00,4000188917,66542,新辣道所用的梭边鱼，源自四川金沙江的野生人工驯化鱼种，遵循严格的科学养殖方法，严格控制环境和池水温度，严格控制鱼的养殖密度，养殖周期仅有五十八天。自贡乃千年盐都，井盐之卤，取自百丈幽泉，未经污染，采用古法小灶，蒸云煮雾，其味中正绵厚，不枯不涩。古法腌菜，采用四川基地天然绿色生产基地的优质蔬菜，使用流传数百年的巨大土陶缸，添加小灶井盐和数十种调料，密封后将陶缸半埋入土，采用此法腌制的酸菜，自然健康，口感爽脆，醇香鲜美。,,False,0,0,66542,True,False
比格比萨自助(旧宫店),40156582,披萨,比格比萨,683881,http://p0.meituan.net/poi/267f05ae182636a4e53beaf973efaacc37889.png,3.9,54,59,旧宫,4752,39.814785,116.454632,大兴区小红门路39号永辉超市一层东侧（嘉美国际影院旁）,,,,单人午/晚餐59元起;,周一至周日 11:00-21:00  2019-02-04至2019-02-05 休息,010-58310577,66520,企业简介Enterprise Brief Introduction 比格比萨创立于2002年，是经营自助比萨为主，兼营零点及外卖的休闲餐厅，历经十多年的发展，比格自助比萨这个连锁品牌，得到了众多消费群体的喜爱。目前比格拥有150多家连锁餐厅，遍布全国20多个省50多个城市。 休闲Leisure 百余款丰富多样的美食，口味地道的纯手工比萨，营养健康的果蔬沙拉，精选西式热菜和甜品……还有餐饮流行风尚的主推新品，随意盛取，不限量。休闲浪漫的环境、温暖周到的服务让您轻松惬意无拘束。 时尚 Fashion 用餐环境简约时尚，全开放舞台式厨房，独有的明厨设计，使您边享受各式美味，边欣赏制作比萨的过程；独创的比格“比萨吧”，既能让厨师量身定做您想吃的比萨，又能受厨师专业指导，自己动手DIY比萨。 健康Health 比格追求高品质，与国际好原料供应商构建了高品质产品体系，奶制品的供应均来自纯净新西兰，调料从全球最好的产地采集，松软的饼底选自优质的小麦意大利品质，肉类食品与五大知名品牌合作，100%保证肉质来源，新鲜果蔬当日配送。严格的选料加上标准的制作确保了比格科学健康、营养均衡的产品出品，让您放心、安心、舒心。 特色Vitality 做中国人喜爱的特色比萨 Do the Chinese love pizza specialties 专业研发人员的经验积累和持续创新形成了比格既符合西餐流行趋势，又适合中国人口味的产品特色。在坚持制作高品质比萨的同时，还不断的探索研究新的比萨品种，继传统的厚饼比萨、薄饼比萨后，比格又独创了双层比萨，深受顾客的喜爱。比格致力于做中国人喜爱的特色比萨！ 比格官网地址：www.bigpizza.bj.cn,,False,1,452,66520,True,False
比格比萨自助(西外店),264445,披萨,比格比萨,683881,http://p0.meituan.net/poi/267f05ae182636a4e53beaf973efaacc37889.png,3.6,57,59,西直门/动物园,16,39.938898,116.341707,西城区西直门外大街137号,,"52,1252,",,单人午/晚餐59元起;,周一至周日 11:00-14:30 17:00-21:00,010-68311887,66301,企业简介Enterprise Brief Introduction 比格比萨创立于2002年，是经营自助比萨为主，兼营零点及外卖的休闲餐厅，历经十多年的发展，比格自助比萨这个连锁品牌，得到了众多消费群体的喜爱。目前比格拥有150多家连锁餐厅，遍布全国20多个省50多个城市。 休闲Leisure 百余款丰富多样的美食，口味地道的纯手工比萨，营养健康的果蔬沙拉，精选西式热菜和甜品……还有餐饮流行风尚的主推新品，随意盛取，不限量。休闲浪漫的环境、温暖周到的服务让您轻松惬意无拘束。 时尚 Fashion 用餐环境简约时尚，全开放舞台式厨房，独有的明厨设计，使您边享受各式美味，边欣赏制作比萨的过程；独创的比格“比萨吧”，既能让厨师量身定做您想吃的比萨，又能受厨师专业指导，自己动手DIY比萨。 健康Health 比格追求高品质，与国际好原料供应商构建了高品质产品体系，奶制品的供应均来自纯净新西兰，调料从全球最好的产地采集，松软的饼底选自优质的小麦意大利品质，肉类食品与五大知名品牌合作，100%保证肉质来源，新鲜果蔬当日配送。严格的选料加上标准的制作确保了比格科学健康、营养均衡的产品出品，让您放心、安心、舒心。 特色Vitality 做中国人喜爱的特色比萨 Do the Chinese love pizza specialties 专业研发人员的经验积累和持续创新形成了比格既符合西餐流行趋势，又适合中国人口味的产品特色。在坚持制作高品质比萨的同时，还不断的探索研究新的比萨品种，继传统的厚饼比萨、薄饼比萨后，比格又独创了双层比萨，深受顾客的喜爱。比格致力于做中国人喜爱的特色比萨！ 比格官网地址：www.bigpizza.bj.cn,,False,1,202,66301,True,False
星米休闲餐厅(富力广场店),41265022,韩国菜,,0,,3.8,62,39,双井,14,39.895021,116.460632,朝阳区东三环中路65号富力广场中区B1层,-1,"1466,128,1451,",,单人餐39元，双人餐78元起，3人餐158元;85代100元;,周一至周日 10:00-21:00,010-59037220,66162,,,False,1,254,66162,True,False
黄记煌三汁焖锅(爱琴海购物中心店),4198128,焖锅,黄记煌三汁焖锅,23781,http://p1.meituan.net/poi/90a7d8a1d16f9b0a1797c94847b4373656180.png,4,81,95,对外经贸,14,39.972139,116.436591,朝阳区七圣路甲7号爱琴海购物中心4层（西坝河百盛购物旁边）,4,"119,143,142,120,",,每满100减2（买单立享）;4人餐188元;95代100元，185代200元;,周一至周日 10:00-22:00,010-84240622,66099,北京黄记煌餐饮管理有限责任公司成立于2003年，是一家综合性餐饮连锁管理企业。黄记煌三汁焖锅在祖传秘方的基础上，结合传统滋补与现代养生，以菜肴精华为基础。烹制适合现代人饮食特点的佳肴。焖锅原料的选择与搭配均经过科学计算，充分达到“营养均衡、鲜香绵嫩”。食客在食用焖锅的同时，还可以选择所有菜品一起焖，或者加特色鲜汤涮吃多种肉类及蔬菜。相信与黄记煌的偶然相遇会变成定期的相会，美食养生，健康一生！,,False,0,119,66099,True,False
川骄海鲜自助(亚运村店),165739001,海鲜自助,,0,,3.7,212,129,亚运村,14,40.005585,116.403819,朝阳区大屯北路慧忠北里小区214号楼中奥华美达大酒店2层,,"1480,",,单人晚餐129元，单人午餐189元，单人午餐209元，单人晚餐259元，单人晚餐279元，单人午/晚餐429元;,周一至周日 11:30-14:00 17:30-21:00 22:00-02:00,010-63333368,66005,,,False,0,832,66005,True,False
汉拿山(方庄店),373345,韩式烤肉,汉拿山,25856,http://p0.meituan.net/poi/2c0577def9e51d5dbb131e5d8fcf419a54667.png,3.8,94,69,方庄/蒲黄榆,20,39.865441,116.426485,丰台区方庄蒲芳路30号芳群园1号（方庄必胜客对面）,,"3802,86,87,",免费停车,双人餐188元起，4人餐358元起;69代100元，89代100元;,周一至周日 10:00-22:00  2019-02-04至2019-02-05 10:00-18:00,010-88222988,65911,北京大牌美食护照集合了9大餐饮大牌,,False,1,266,65911,True,False
牛排家(三里屯店),92686369,牛排,,0,,5,171,82,三里屯/工体,14,39.931588,116.455141,朝阳区南三里屯路通盈中心3层,3,null,,单人餐128元起，单人餐128元起，双人餐368元;82代100元;,周一至周日 11:00-22:00  2019-02-04至2019-02-09 休息,010-57809040/15011101390,65750,,,False,0,602,65750,True,False
川成串 串串香火锅(磨房北里店),6940692,串串香,,0,,4.9,67,89,劲松,14,39.882432,116.471454,朝阳区磨房北里215号楼川成串（农光东里路）,,"4655,129,3794,",有停车位,89代100元;,周一至周日 12:00-24:00  2019-02-02至2019-02-11 休息,010-67316678,65217,,,False,0,262,65217,True,False
唐宫海鲜舫(朝阳大悦城店),341080,广州菜,唐宫,342126,http://p0.meituan.net/poi/cb620af2cfc4f2450feedaf57dc7e03944936.png,3.8,97,198,朝阳大悦城,14,39.923816,116.519039,朝阳区朝阳北路101号朝阳大悦城9层,9,"1263,",,每满100减5（买单立享）;双人餐198元，4人餐398元，10人餐1998元;,周一至周日 10:00-22:00,010-85529488/85563488,65150,香港唐宫饮食集团成立于1992年，至今旗下拥有7个品牌，36家分店及1家食品工厂。分店分布于北京、天津、上海、杭州、苏州、深圳、东莞、澳门等，唐宫海鲜舫出品力求创新，以新派粤菜、港式茶点为主，菜式搭配追求健康，在北京广受好评。新世纪唐宫海鲜舫、望京盛世唐宫、朝阳大悦城唐宫海鲜舫、丰联唐宫海鲜舫迎合市场需求，以时尚婚宴为主题，采用独特风格装潢设计，大厅金碧辉煌、艳丽迷人，或华贵、或时尚、或经典，处处巧手匠心。为您专业的设计婚宴场景及专门配置的重量级影音设备，充分彰显您的尊贵身份。,,False,1,29,65150,True,False
