店铺名称,页面id,类别,品牌名称,品牌id,品牌logo,评分,平均价格,最低价格,所属地区,地区Id,纬度,经度,详细地址,楼层,地铁站id,停车信息,优惠套餐情况,营业时间,联系电话,累计售出份数,餐厅简介,特色菜,是否小吃,有无外卖,上周订单数,历史订单数,wifi,支持预定
芦月轩羊蝎子(太平桥店),366272,羊蝎子,芦月轩,957116,,5,63,89.9,北京西站/六里桥,20,39.878813,116.31735,丰台区太平桥路15号楼（永辉超市南侧）,,"100,",,3-4人餐246元;89.9代100元;,周一至周日 11:00-23:00,010-63480189,46607,冲着他家羊蝎子来的。“扑鼻”的香气让人食指大动，肉炖得“很烂”，骨髓“多”，味道“美极了”；分量还“相当足”，“两三个人吃小锅就够了”。要是再点些宽粉、炸腐竹什么的涮在里面，得撑个“肚歪”。价格也“挺实惠”。只是服务“差了些”，“没眼力见儿”。,,False,0,248,46607,True,False
大鸭梨烤鸭店(大慧寺店),263839,烤鸭,大鸭梨,24976,http://p1.meituan.net/poi/a45acee85a01c13509676b448324d2f86549.png,4.4,64,88,魏公村,17,39.951841,116.332311,海淀区大慧寺路18号（近北方交大）,,,,满100减12（买单立享）;双人餐199元，3-4人餐298元，6-7人餐588元，9-10人餐888元;88代100元;,周一至周日 09:30-14:30 17:00-21:30  2019-02-04至2019-02-10 10:00-21:00,010-62189772/4007328080,46583,大鸭梨烤鸭店，老远就看见了就会让人想象到那张憨态可掬的笑脸，夸张的卡通造型像鸭又像梨，透着一份亲切。大鸭梨的陈设典雅大方，色调明快柔和，更显独特韵味。大鸭梨的饭菜好吃不贵。不论档次高低，每一道菜都被烹制得有形有色更有味，虽是家常，却不寻常低廉的价位更是难得，许多人干脆将这里当作自家饭厅，优质烤鸭：色泽红艳，肉质细嫩，味道醇厚，肥而不腻的特色，色泽略黄，柔软淡香，夹卷其他荤素食物用，为宴席常用面点，更是家常风味小吃,,False,1,443,46583,True,False
比格比萨自助(航天万源店),375386,披萨,比格比萨,683881,http://p0.meituan.net/poi/267f05ae182636a4e53beaf973efaacc37889.png,3.6,51,59,南苑机场/德茂桥,4752,39.80298,116.42352,大兴区东高地万源路航天万源广场4楼,4,"4876,",,单人午/晚餐59元起;,周一 10:30-14:30 17:00-21:30  周二至周日 10:30-21:30  2019-09-30至2019-10-01 休息,010-88030804,46535,企业简介Enterprise Brief Introduction 比格比萨创立于2002年，是经营自助比萨为主，兼营零点及外卖的休闲餐厅，历经十多年的发展，比格自助比萨这个连锁品牌，得到了众多消费群体的喜爱。目前比格拥有150多家连锁餐厅，遍布全国20多个省50多个城市。 休闲Leisure 百余款丰富多样的美食，口味地道的纯手工比萨，营养健康的果蔬沙拉，精选西式热菜和甜品……还有餐饮流行风尚的主推新品，随意盛取，不限量。休闲浪漫的环境、温暖周到的服务让您轻松惬意无拘束。 时尚 Fashion 用餐环境简约时尚，全开放舞台式厨房，独有的明厨设计，使您边享受各式美味，边欣赏制作比萨的过程；独创的比格“比萨吧”，既能让厨师量身定做您想吃的比萨，又能受厨师专业指导，自己动手DIY比萨。 健康Health 比格追求高品质，与国际好原料供应商构建了高品质产品体系，奶制品的供应均来自纯净新西兰，调料从全球最好的产地采集，松软的饼底选自优质的小麦意大利品质，肉类食品与五大知名品牌合作，100%保证肉质来源，新鲜果蔬当日配送。严格的选料加上标准的制作确保了比格科学健康、营养均衡的产品出品，让您放心、安心、舒心。 特色Vitality 做中国人喜爱的特色比萨 Do the Chinese love pizza specialties 专业研发人员的经验积累和持续创新形成了比格既符合西餐流行趋势，又适合中国人口味的产品特色。在坚持制作高品质比萨的同时，还不断的探索研究新的比萨品种，继传统的厚饼比萨、薄饼比萨后，比格又独创了双层比萨，深受顾客的喜爱。比格致力于做中国人喜爱的特色比萨！ 比格官网地址：www.bigpizza.bj.cn,,False,1,251,46535,True,False
吉野家(新奥购物中心店),1655507,日式快餐,吉野家,26363,http://p1.meituan.net/poi/701df473397a9a489e7ed59bae855d8741844.png,5,28,1.99,鸟巢/水立方,14,39.999208,116.396304,朝阳区湖景东路11号新奥购物中心H1层（近国家体育场北路）,1,"96,1484,",有停车位,单人餐1.9元起，13元鱼香肉丝套餐，18元B8鸭腿饭，21元B12大碗鸡肉饭，24.9元B13辣猪双拼，29元B2鸡粒辣猪套餐，2-3人餐65元;,周一至周日 10:00-20:00,010-84371107,46373,吉野家是一家享有百年历史的著名日本牛肉饭专门店，始创於1899年，良心品质风行百年。吉野家一直以良心品质为本，所有食品均采用精选上等材料烹制而成，即叫即制，务求给予顾客最新鲜、**品质的食品。为了能令顾客无论何时何地都能品尝到少有的味美，吉野家一直始终如一地追求贯注「良心」的「真正品质」，为大家提供快速的服务，舒适的环境以及品质优良、价格合理的美食。日式快餐店。厅堂“干净明亮”，服务“快捷周到”，食物“原汁原味”，“营养健康”。牛肉饭“最经典”，肉“又嫩又香”，米饭“粒粒分明”。一些分店还连着DQ，吃完饭来份“暴风雪”，“爽就一个字”。,,False,1,1287,46373,True,False
旬野菜·日式涮涮锅专门店(方庄店),159408327,日式火锅,,0,,4.6,151,138,方庄/蒲黄榆,20,39.865387,116.435327,丰台区蒲方路时代LIFE购物中心5楼,5,"3797,3802,",,单人午餐138元，单人晚餐158元，单人晚餐158元;,周一至周日 11:00-16:00 17:00-21:30,010-53115014,46211,,,False,0,695,46211,False,False
龙达园(永丰店),277057,海鲜,龙达园,1206763,,4,91,0,海淀区,17,40.07133,116.24365,海淀区西北旺镇永丰路与北清路交叉口西南角（六里屯东口）,,"4160,",,,周一至周日 10:00-14:00 17:00-21:00  2019-02-01至2019-02-12 休息,010-82478808/010-62442100,46209,龙达园餐厅位于海淀区西北旺镇永丰路，主营铁板烧，小海鲜，家常菜。店内环境宽敞明亮整洁优雅，是您商务宴请，同事小聚的理想去处。,,False,1,77,46209,True,False
壹零捌道(白纸坊店),96593591,烤鸭,,0,,5,89,53,白纸坊,16,39.873752,116.348437,西城区南滨河路87号,,,,双人餐53元起，4人餐188元，3-4人餐429元;95代100元;,周一至周日 09:00-14:00 17:00-21:00,010-63439841,46182,,,False,1,168,46182,True,False
三五堂(新国贸饭店店),158829480,综合自助,,0,,4.3,174,320,国贸/建外,14,39.91317,116.460496,朝阳区建国门外大街1号新国贸饭店2层,2,"126,127,20,",,双人晚餐320元，双人午餐320元，双人午餐356元，双人晚餐356元，[3]人午/晚餐436元;,周一至周日 11:30-14:30 17:30-21:30,010-86471035,46069,,,False,0,660,46069,False,False
流忙村自助餐(望京店),5815740,韩国菜,流氓村,722695,http://p0.meituan.net/poi/7d3164b5ecc20151320b7b389718baa674517.png,3.8,73,156,望京,14,39.995617,116.468676,朝阳区广顺北大街西园四区423-424号楼韩国美食城2层,2,"147,1485,1490,",免费停车,双人餐156元起，3人餐229元起，4人餐306元起;,"周六,周日 11:00-15:30 17:00-22:00  周一至周五 11:00-14:30 17:00-21:30",010-64705055,45951,,,False,1,224,45951,True,False
茶大爷(欧美汇购物中心店),364729,奶茶/果汁,茶大爷,970854,,3.8,10,3.9,中关村,17,39.979704,116.313821,海淀区中关村丹棱街甲1号欧美汇购物中心B1楼（萨莉亚旁）,-1,"47,48,110,109,",免费停车,9折（买单立享）;3.9元招牌饮品，9.8元超值饮品;,周一至周日 10:00-21:30,010-82674248,45916,,,False,1,212,45916,True,False
黄记煌三汁焖锅(四道口店),265312,焖锅,黄记煌三汁焖锅,23781,http://p1.meituan.net/poi/90a7d8a1d16f9b0a1797c94847b4373656180.png,4.3,80,95,大钟寺,17,39.958734,116.347234,海淀区学院南路33号（近四道口艺海金五星百货铁道西侧）,,"131,",,每满100减2（买单立享）;95代100元，185代200元;,周一至周日 10:00-22:00,010-62131873,45912,黄记煌是一家综合性餐饮连锁管理企业，三汁焖锅在祖传秘方的基础上，结合传统滋补与现代养生，以菜肴精华为基础。烹制适合现代人饮食特点的佳肴。焖锅原料的选择与搭配均经过科学计算，充分达到“营养均衡、鲜香绵嫩”。食客在食用焖锅的同时，还可以选择所有菜品一起焖，或者加特色鲜汤涮吃多种肉类及蔬菜。相信与黄记煌的偶然相遇会变成定期的相会，美食养生，健康一生！,,False,1,134,45912,True,False
一味一诚·重庆烤鱼(昌平店),5330585,烤鱼,一味一诚,89984,http://p0.meituan.net/poi/4358fd6c930df6ad2fc1d9de74713662280586.png,4.3,66,95,昌平镇,4750,40.212212,116.239023,昌平区南环路8号院金隅万科广场6层,6,,免费停车,双人餐199元，4人餐319元;95代100元;,周一至周日 10:30-21:30,010-60736512,45869,一味一诚银碳烤鱼新店装修也更有风格，挑高空间里故意未打磨的水泥墙面和做旧原木、镜子结成空旷冷峻的组合，绒面深绛红色沙发椅、阔叶绿植、华丽的水晶吊灯和暖黄灯光则很好的平衡了整个空间的明暗度，音乐也一如既往的用心选择了各种旋律很抓人的英文歌，而不是街歌和网络口水歌。作为一家口味能排到前三的烤鱼店，装修还这么有情调，简直令吃货们感动到内牛满面好吗。服用烤鱼的时候终于也能小清新了。光拍餐厅环境不拍鱼的话也能伪装自己在咖啡馆里劈情操了。重要的是新店面积大很多，终于不用很丢脸的为了口吃的排半天队了好吗。香辣味。,,False,1,93,45869,True,False
桃山旬野菜村日式火锅(凯德MALL店),164902951,日式火锅,桃山旬野菜村日式火锅,2884438,,3.7,173,143,西直门/动物园,16,39.941238,116.35263,西城区西直门外大街1号凯德MALL4层,4,"130,24,53,1253,",,单人午餐143元，单人晚餐168元，单人午餐203元，单人晚餐228元，单人午餐253元，单人晚餐278元;,周一至周日 11:00-15:00 17:00-21:00,010-58302034,45857,,,False,0,466,45857,False,False
新辣道鱼火锅(四通华宇店),4092117,鱼火锅,新辣道,1833433,http://p0.meituan.net/poi/26ef5d50481923db677d37085ce964e322599.png,4.2,84,91,双榆树,17,39.965301,116.323249,海淀区中关村南大街2号华宇时尚购物中心4楼（近人民大学）,4,"49,50,",,每满100减9（买单立享）;双人餐169元;91代100元;,周一至周日 10:00-21:00  2019-02-04至2019-02-09 休息,400-018-8917,45834,新辣道所用的梭边鱼，源自四川金沙江的野生人工驯化鱼种，遵循严格的科学养殖方法，严格控制环境和池水温度，严格控制鱼的养殖密度，养殖周期仅有五十八天。自贡乃千年盐都，井盐之卤，取自百丈幽泉，未经污染，采用古法小灶，蒸云煮雾，其味中正绵厚，不枯不涩。古法腌菜，采用四川基地天然绿色生产基地的优质蔬菜，使用流传数百年的巨大土陶缸，添加小灶井盐和数十种调料，密封后将陶缸半埋入土，采用此法腌制的酸菜，自然健康，口感爽脆，醇香鲜美。,,False,1,50,45834,True,False
便宜坊烤鸭店(幸福大街店),264597,烤鸭,便宜坊,24544,http://p1.meituan.net/poi/ded2f8cf40b8018840ddf3b70ac5705520979.png,3.7,98,92,天坛,15,39.887284,116.431442,东城区幸福大街36号,,"1462,",,每满100减5（买单立享）;双人餐168元起，4人餐498元，6人餐688元;92代100元，270代300元，440代500元;,周一至周日 11:00-14:00 17:00-21:30  2019-10-01 休息,010-67116545,45752,便宜坊（biàn yì fānɡ）创建于明朝永乐十四年（公元1416年），距今已有近600年的历史，是中国商务部首批认定并授予牌匾的“中华老字号”。2001年通过ISO9001国际质量体系认证；2003年被全国酒家酒店等级评定委员会评定为“国家特级酒家”；2005年荣获中国饭店协会授予的“中国十佳酒家”称号；同年荣获国际饭店协会授予的“国际餐饮名店”称号。便宜坊经营的“焖炉烤鸭”是北京烤鸭两大流派之一。其特点是皮酥肉嫩，口味鲜美，又因其烤制过程鸭子不见明火，保证烤鸭表面无杂质，而被誉为“绿色烤鸭”。2002年被中国国内贸易局评定为“中国名菜”。2006年12月便宜坊焖炉烤鸭技艺列入北京市非物质文化遗产保护名录，2008年6月列入非物质文化遗产保护名录。,,False,1,110,45752,True,False
巴依老爷新疆美食(魏公村店),4708523,新疆菜,巴依老爷新疆美食,496084,,4.9,69,81.81,魏公村,17,39.953764,116.317322,海淀区民族大学西路民族大学西门向北100米路东,,"50,",免费停车,双人餐98.1元，3-4人餐319元;81.8代90元;,周一至周日 11:00-23:00,010-88571204,45629,,,False,1,120,45629,True,False
便宜坊烤鸭店(玉蜓桥店),82253057,烤鸭,便宜坊烤鸭店,24545,http://p0.meituan.net/poi/0d57a201bfd68f82a1b29363aff22f7721035.png,3.7,76,88,天坛,15,39.87394,116.42091,东城区天坛东路73号（近天坛东门）,,"86,3802,85,",有停车位,每满100减5（买单立享）;双人餐88元;92代100元，270代300元，440代500元;,周一至周日 11:00-21:00  2019-09-30至2019-10-01 休息,010-67020904,45573,,,False,1,189,45573,True,False
福成自助烤肉(长阳店),177810967,烤肉自助,,0,,5,67,66,长阳镇,710,39.771472,116.168624,房山区长阳镇昊天北大街华冠天地4层,4,,,单人午/晚餐66元;,周一至周日 11:00-14:00 17:00-21:00,010-89367660,45526,,,False,0,1240,45526,False,False
巴黎贝甜(凯德晶品万寿路店),1534113,蛋糕,巴黎贝甜,24296,http://p0.meituan.net/poi/00faa633c970bdbf682bedfb92d2b90c6392.jpg,4.2,29,10.78,公主坟/万寿路,17,39.908214,116.297434,海淀区复兴路51号凯德晶品购物中心LG楼（costacoffee旁）,-1,"7,",,10.7元蒙布朗栗子起酥，10.7元芋泥多多面包，22.5元新品茶饮二选一;48代50元，72代80元;,周一至周日 10:00-22:00,010-68260928,45489,巴黎贝甜是艾丝碧西旗下的品牌。北京艾丝碧西食品有限公司是由韩国食品连锁集团之一的SPC集团投资成立的综合食品企业。Paris Bagutte巴黎贝甜是韩国历史最悠久的食品企业SPC集团旗下的韩国烘焙品牌。目前在韩国，美国（洛杉矶、纽约），中国（上海、北京、天津）拥有1500多家连锁店。主要经营正宗法式面包、新鲜三明治、美味蛋糕、纯正咖啡。巴黎贝甜以60年的烘焙经验及采用新鲜、高级材料的公司宗旨为消费者提供健康美味的产品。,,False,1,12,45489,True,False
羲和雅苑烤鸭坊(国贸商城店),1646400,烤鸭,羲和雅苑烤鸭坊,29576,http://p1.meituan.net/poi/edfb5fbeea49bb43077af8b3ddf8c581178389.png,4.1,154,9.9,国贸/建外,14,39.909404,116.457628,朝阳区建国门外大街1号国贸商城南区B1层SB127-SB128,-1,"20,127,19,126,",免费停车,每满100减5（买单立享）;单人餐9.9元，双人餐188元起，2-3人餐218元，4人餐528元起，6人餐888元起，10人餐1788元起，10人餐1788元起;80代100元;,周一至周日 11:00-21:30,010-65056927/65056587,45235,羲和国际餐饮机构是一家传统与现代兼容并蓄，致力于弘扬发展中华饮食文化的餐饮机 构，依托旗下“羲和雅苑”和“羲和小馆”，以其固有的青砖灰瓦，雕梁画柱式的明清四合院装饰风格的就餐环境与坐落周边的超甲级商厦与写字楼相映成趣，鲜明衬托出现代与古典的结合。力求实现高贵在典雅中找到和谐，典雅于高贵中得以升华的文化理念。,,False,1,846,45235,True,False
川成元·麻辣香锅(凯德MALL西直门店),281315,干锅/香锅,川成元麻辣香锅,491524,http://p1.meituan.net/poi/ace31af40b316fbaaa2adca6c421b5564767.jpg,3.6,81,95,西直门/动物园,16,39.941498,116.352621,西城区西直门外大街1号凯德MALL4楼（近西直门地铁站）,4,"130,24,53,",停车位收费标准：请询问商家,每满100减5（买单立享）;双人餐158元;95代100元;,周一至周日 10:00-22:00,010-58302493,45173,北京为之味餐饮有限公司成立于2000年，多年来专注发展有潜力和有特色的菜系，目前公司旗下拥有品牌：川成元、金汤玉线、夹拣成厨、姑姑宴等品牌。川成元以川味菜品为主，精专麻辣香锅和川味小吃；金汤玉线为主打滇西新派过桥米线的连锁快餐厅；姑姑宴为首家四川名小吃荟萃主题餐厅。 经过多年艰苦卓绝的建设，目前公司在北京已发展32家直营连锁特色餐厅，另外也和新加坡的大食代在北京和天津的多个美食广场合作了6个特色档口。公司拥有专业的管理团队、经验丰富的餐饮从业人员；具备严谨的服务流程、质量管理体系；并建立了中央厨房和配送中心，统一加工、配送食材，保证旗下各连锁餐厅、连锁档口菜品出品规格及标准统一。同时公司与望京嘉茂购物中心、西直门嘉茂购物中心、东方新天地、中关村广场购物中心、国瑞购物中心、华熙长安MALL、华贸购物中心等各大商城、以及富力地产、携程网、可口可乐公司、百威以及新加坡大食代餐饮有限公司等多家知名企业建立了良好的合作关系。多年来北京为之味餐饮有限公司秉承“提供给每一位顾客满意就餐体验”的经营宗旨，致力于提升、完善产品质量和服务质量，打造持久的、高水准的“为之味” 餐饮品牌，以回报广大顾客。,,False,1,54,45173,True,False
巴黎贝甜(印象城店),356157,蛋糕,巴黎贝甜,24296,http://p0.meituan.net/poi/00faa633c970bdbf682bedfb92d2b90c6392.jpg,4.2,29,48,公主坟/万寿路,17,39.912454,116.30275,海淀区翠微路12号新华联商业大厦印象城1楼（翠微大厦南侧）,-1,"1273,8,7,",,48代50元;,周一至周日 08:00-22:00,010-68219569,45157,巴黎贝甜是艾丝碧西旗下的品牌。北京艾丝碧西食品有限公司是由韩国食品连锁集团之一的SPC集团投资成立的综合食品企业。Paris Bagutte巴黎贝甜是韩国历史最悠久的食品企业SPC集团旗下的韩国烘焙品牌。目前在韩国，美国（洛杉矶、纽约），中国（上海、北京、天津）拥有1500多家连锁店。主要经营正宗法式面包、新鲜三明治、美味蛋糕、纯正咖啡。巴黎贝甜以60年的烘焙经验及采用新鲜、高级材料的公司宗旨为消费者提供健康美味的产品。,,False,1,0,45157,True,False
便宜坊(凯德MALL太阳宫店),1545264,烤鸭,便宜坊,24544,http://p1.meituan.net/poi/ded2f8cf40b8018840ddf3b70ac5705520979.png,4,84,89,太阳宫,14,39.971896,116.447522,朝阳区太阳宫中路12号凯德MALL5层,5,"120,",,4人餐368元，8人餐688元，10人餐899元起;89代100元，440代500元，850代1000元;,周一至周日 11:00-14:00 17:00-22:00,010-84150879,44904,北京悦府盛宴餐饮管理有限公司地处市区繁华黄金地段，地理位置优越，交通便利。会所设施齐全，装修豪华典雅，别俱一格。会所拥有大型宴会厅，KTV包厢及多功能厅等，并采用了科学的经营机制和管理方法。公司致力于高端中餐，以“宾客至上，服务**”为宗旨，为顾客提供高品质的餐饮服务。不断追求卓越，得到了社会各界的一致好评，悦府餐饮真诚恭候您的光临！,,False,1,401,44904,True,False
美都波韩国烤肉(五棵松店),165868372,韩式烤肉,,0,,5,99,88,五棵松,17,39.9131,116.280647,海淀区复兴路69号瑞丰园美食新天地1层,1,"6,",,1-2人餐218元，1-2人餐218元，2-3人餐298元，3人餐398元，4-6人餐498元;88代100元;,"周一至周五 11:00-22:00  周六,周日 11:00-15:00 17:00-22:00",010-68217721/68217860,44802,,,False,1,627,44802,False,False
东方宫中国兰州牛肉拉面(交大东路店),5139474,面条,东方宫中国兰州牛肉面,1659776,,4.3,22,13,北下关,17,39.94528,116.35017,海淀区交大东路66号（近西直门地铁A口）,,"130,24,53,",免费停车,13元牛肉大葱饺子，13元韭菜鸡蛋饺子，25.9元肉蛋双飞单人套餐，26.4元凉面单人套餐，48元肉蛋双飞双人套餐，52.8元凉面双人餐;,周一至周日 07:00-21:00  非营业时段 2018-02-15至2018-02-16 14:00-24:00,010-56243000,44744,兰州牛肉面始于清朝末年，至今已有百年历史。以肉烂汤鲜、纯手工拉面筋劲细长蜚声中外，赢得国内外食客的喜爱和好评。考究的用料、精湛的工艺、悠久的历史，使其成为中华饮食文化的代表之一。1999年，兰州牛肉面被国家确定为中式三大快餐之一、被誉为“中华**面”，兰州被誉为“中国牛肉面之乡”,,False,1,135,44744,True,False
吉野家(西直门店),1650683,日式快餐,吉野家,26363,http://p1.meituan.net/poi/701df473397a9a489e7ed59bae855d8741844.png,4.2,28,1.99,西直门/动物园,16,39.94133,116.353777,西城区西直门外大街1号西环广场B1楼（近西直门桥）,-1,"130,24,53,1253,",,单人餐1.9元起，13元鱼香肉丝套餐，18元B8鸭腿饭，2-3人餐65元;,周一至周日 07:00-21:30  2019-02-08至2019-02-09 10:00-15:00,010-58301195,44709,吉野家是一家享有百年历史的著名日本牛肉饭专门店，始创於1899年，良心品质风行百年。吉野家一直以良心品质为本，所有食品均采用精选上等材料烹制而成，即叫即制，务求给予顾客最新鲜、**品质的食品。为了能令顾客无论何时何地都能品尝到少有的味美，吉野家一直始终如一地追求贯注「良心」的「真正品质」，为大家提供快速的服务，舒适的环境以及品质优良、价格合理的美食。日式快餐店。厅堂“干净明亮”，服务“快捷周到”，食物“原汁原味”，“营养健康”。牛肉饭“最经典”，肉“又嫩又香”，米饭“粒粒分明”。一些分店还连着DQ，吃完饭来份“暴风雪”，“爽就一个字”。,,False,1,584,44709,True,False
巫山烤全鱼(北大店),1497039,烤鱼,,0,,3.9,63,88,北京大学,17,39.986412,116.313086,海淀区海淀路21号1幢,,"47,46,",,双人餐88元，4人餐148元;,周一至周日 10:30-23:00  2019-02-14至2019-02-15 休息,010-62613086,44553,秉着更好的为消费者服务，江边码头潜心钻研，不断创新，以高品质的菜品、优良的服务、合理的价格服务于广大消费者。江边码头精选食材、配料，精心研制10种口味的巫山烤全鱼，无论来自何地，无论爱吃酸甜苦辣，总有一款适合自己。,,False,1,128,44553,False,False
眉州东坡(北苑华贸店),6712797,川菜,眉州东坡酒楼,840209,http://p1.meituan.net/poi/22f83d3ddb274d5140e7158223eb093312092.png,4.2,79,95,立水桥/北苑家园,14,40.048232,116.430547,朝阳区清河营南街华贸城七号院东区8号楼3层,3,"140,",,95代100元;,周一至周日 06:30-22:00,010-57393238/010-57393151/4008527527,44524,1996年6月6日，由全国人大常务委员会副委员长王光英题匾，并经北京市朝阳区工商局注册的**家眉州东坡酒楼在京开业。为使企业得到迅速发展，企业于2003年6月24日成立了以饭店管理、餐饮服务、食品加工及销售为主要经营范围的北京眉州酒店管理有限公司，并在京设立公司总部，包括物流中心、中央厨房，注册资金6000万元。公司现已成为旗下拥有“眉州东坡酒楼”、“王家渡火锅”、“眉州小吃”、“眉州私家厨房”、“四川王家渡食品有限公司”五大业态、五十多家分店、6000多名员工的大型餐饮连锁集团。2011年5月31日，成立北京眉州东坡万景投资有限公司，以传承“东坡文化”为核心，以“东坡美食文化”为载体，发展集团美食、娱乐、休闲、购物、旅游、商务等多种业务为一体的服务综合体。将在湖北黄冈市开发十万平方米左右的商业综合项目。,,False,1,44,44524,True,False
眉州东坡(远洋未来广场店),52490288,川菜,眉州东坡酒楼,840209,http://p1.meituan.net/poi/22f83d3ddb274d5140e7158223eb093312092.png,4.9,78,95,小营,14,39.990368,116.433112,朝阳区北四环东路73号远洋未来广场5层,5,,,95代100元;,周一至周日 10:00-22:00,010-84445527/400-852-7527,44493,,,False,1,114,44493,True,False
